{"artifactId":"71ee9640-daa7-4abd-8980-83bc53607f14","claimSurface":"candidate_support_evidence","constructorSupportStatus":"root_traceable","evidenceClass":"engram_candidacy_evidence","inspectionPosture":"mixed_pointerized","intentClassification":"reviewable_support_evidence","phase5HandoffReady":true,"protectedEvidenceRefs":[{"digestSha256":"30c1958e3c8f027fd2545d3558aa7fc71bd2ac948b45e53c19545797687cc1d8","pointerUri":"custody://engram/root","refId":"engram-root","summary":"Protected constructor evidence for the root form"}],"provenanceBasis":"phase3_temporal_support","rootCoherenceSignals":["root-form remains coherent across the lawful widened horizon","constructor trace remains pointerized and reviewable","visible claim surface is bounded by protected provenance","root-form remains reviewable for later human support examination"],"rootCoherenceStatus":"coherent_support","rootFormId":"71ee9640-daa7-4abd-8980-83bc53607f14-root-form","schema":"oan.hopng_perspectival_engram","schemaVersion":"0.1.0","supportOnly":true,"supportShape":"root_constructor_support","validationQuestions":["Does the root-form remain traceable to the protected provenance basis?","Does the visible claim surface stop short of identity admission?","Is the strengthened support still bounded by Phase 4 reviewable-support limits?"],"workingIntentState":"reviewable_support"}