{"artifactId":"a9038cc7-8dc5-497c-ad6f-99d477562f4d","claimSurface":"candidate_support_evidence","constructorSupportStatus":"root_restricted_pending_clarification","evidenceClass":"engram_candidacy_evidence","inspectionPosture":"mixed_pointerized","intentClassification":"restricted_support_evidence","phase5HandoffReady":false,"protectedEvidenceRefs":[{"digestSha256":"30c1958e3c8f027fd2545d3558aa7fc71bd2ac948b45e53c19545797687cc1d8","pointerUri":"custody://engram/root","refId":"engram-root","summary":"Protected constructor evidence for the root form"}],"provenanceBasis":"phase3_temporal_support","restrictionReason":"Protected constructor evidence remains lawful, but custody posture requires a restricted support lane.","rootCoherenceSignals":["root-form remains coherent across the lawful widened horizon","constructor trace remains pointerized and reviewable","visible claim surface is bounded by protected provenance","root-form remains traceable but requires bounded restriction before promotion"],"rootCoherenceStatus":"restricted_support","rootFormId":"a9038cc7-8dc5-497c-ad6f-99d477562f4d-root-form","schema":"oan.hopng_perspectival_engram","schemaVersion":"0.1.0","supportOnly":true,"supportShape":"root_constructor_support","validationQuestions":["Does the root-form remain traceable to the protected provenance basis?","Does the visible claim surface stop short of identity admission?"],"workingIntentState":"restricted_support"}